type,name,label,hint,constraint,constraint_message,required,required_message,appearance,default,readonly,relevant,calculation,choice_filter,repeat_count,label::language1,hint::language1,media::audio,media::image,body::accuracyThreshold,bind::esri:fieldType,bind::esri:fieldLength,bind::esri:fieldAlias,body::esri:inputMask,bind::esri:parameters,bind::saveIncomplete,,,,,,
,,,,,,,,,,,,,,,,,,,,,,,,,,,,,,,
start,FORM_START,Form Start Date and Time,,,,,,,,,,,,,,,,,,esriFieldTypeDate,,,,,,,,,,,
end,FORM_END,Form End Time,,,,,,,,,,,,,,,,,,esriFieldTypeDate,,,,,,,,,,,
username,FO_S123_USERNAME,Form Username,,,,,,,,,,,,,,,,,,esriFieldTypeString,255,,,,,,,,,,
,,,,,,,,,,,,,,,,,,,,,,,,,,,,,,,
begin group,G_CONFIG,Form Configuration,,,,,,compact,,,,,,,,,,,,,,,,,,,,,,,
select_one DBMP_on_off,SHOW_HELP,Display Help Images,,,,,,horizontal,off,,,,,,,,,,,null,,,,,,,,,,,
end group,,,,,,,,,,,,,,,,,,,,,,,,,,,,,,,
,,,,,,,,,,,,,,,,,,,,,,,,,,,,,,,
begin group,G_INSPECTION_META,Inspection Metadata,,,,,,,,,,,,,,,,,,,,,,,,,,,,,
geopoint,geometry,Inspection Location,"The location comes via location services. Accuracy is required to be within 30 meters, so make sure you are outside with a clear view of the sky.",,,,,,,,,,,,,,,,30,,,,,,,,,,,,
text,FACILITY_ID,Facility ID,This is a unique facility ID that links the inspection back to the SWMFAC table.,,,,,,,yes,,,,,,,,,,esriFieldTypeString,42,,,,,,,,,,
text,SWM_FAC_NO,SHA SWMFAC Number,The six digit BMP number,,,,,,,yes,,,,,,,,,,esriFieldTypeString,38,,,,,,,,,,
text,INSPECTR,Inspector Initials,"Comma separated initials of each inspector with no spaces, e.g. ERP,BEW,EA","regex(.,'^[A-Za-z]+(?:,[A-Za-z]+)*$')",Invalid entry for Inspector Initials. Check the format.,yes,At least one inspector initials is required,,,,,,,,,,,,,esriFieldTypeString,11,,,,,,,,,,
select_one DBMP_firm,FIRM_NAME,Firm,,,,yes,The firm name is required,,,,,,,,,,,,,esriFieldTypeString,50,,,,,,,,,,
end group,,,,,,,,,,,,,,,,,,,,,,,,,,,,,,,
,,,,,,,,,,,,,,,,,,,,,,,,,,,,,,,
begin group,G_BMP_INSPECT_CRIT,BMP Inspection Criteria,,,,,,,,,,,,,,,,,,,,,,,,,,,,,
select_one DBMP_yes_no,FO_UNDERGROUND_YN,Is this an underground BMP?,,,,yes,Underground Inspection required,horizontal,no,,,,,,,,,,,esriFieldTypeString,3,,,,,,,,,,
select_one DBMP_Inspection_Type,INSPECTION_TYPE,Inspection Type,,,,yes,Inspection Type is a <b>required</b> selection.,horizontal,,,,,,,,,,,,esriFieldTypeString,2,,,,,,,,,,
text,OTHER_INSP_TYPE_DESC,<i>Other</i> inspection type,,,,,,,,,${INSPECTION_TYPE}='OT',,,,,,,,,esriFieldTypeString,50,,,,,,,,,,
date,DATE_INSP,Inspection Date,,,,yes,Inspection Date is required,,today(),,,,,,,,,,,esriFieldTypeDate,,,,,,,,,,,
note,,SOP Section 3.4.3 excerpt,,,,,,,,,${SHOW_HELP}='on',,,,,,,bmp_inspect_crit.png,,,,,,,,,,,,,
note,,Not Scored -vs- Not Rated,<b>Not Rated (<i>NR</i>)</b> means that the inspector could not access the feature to inspect. <i>Not Rated</i> is the default choice.<p><b>Not Scored (<i><tt>0</tt></i>)</b> means that the inspection parameter is <i>not part of the BMP design</i>. Certain scores do not have a <i>Not Part of BMP Design</i> rating because they must be scored.,,,,,,,,${SHOW_HELP}='on',,,,,,,,,,,,,,,,,,,,
,,,,,,,,,,,,,,,,,,,,,,,,,,,,,,,
begin group,G_SITE_CONDITION,Site Conditions,,,,,,,,,,,,,,,,,,,,,,,,,,,,,
note,,Visibility Table,,,,,,,,,${SHOW_HELP}='on',,,,,,,visibilityscoring.png,,,,,,,,,,,,,
select_one DBMP_Insp_Sco,VISIBLE,Visibility,"Scores the relative visibility of the facility from surrounding roadways, office complexes, shopping centers, residential areas, or other areas.",,,yes,Visibility is a <b>required</b> selection.,likert,nr,,,,,,,,,,,esriFieldTypeString,255,,,,,,,,,,
select_one DBMP_Insp_Sco,MOW,Mowability,Scores the areas requiring routine mowing and slope considerations for allowing the mowing function to take place.,,,yes,Mowability is a <b>required</b> selection.,likert,nr,,,,,,,,,,,esriFieldTypeString,2,,,,,,,,,,
select_one DBMP_Insp_Sco_nozero,ACCESS_,BMP Access,"Scores the existence of a maintenance access road and, if it exists, how well is it designed to meet SHA criteria.",,,yes,Access is a <b>required</b> selection.,likert,nr,,,,,,,,,,,esriFieldTypeString,255,,,,,,,,,,
text,COM_ACCESS,Access Comment,Describes issues relating to accessing a BMP site for field inspection or remedial actions.,,,,,,,,,,,,,,,,,esriFieldTypeString,255,,,,,,,,,,
begin repeat,BMP_R_ACCESS_,Access Issue Photos,,,,,,,,,,,,,,,,,,,,,,,,,,,,,
image,ACCESS__PHOTO,Photo,,,,,,,,,,,,,,,,,,,,,,,,,,,,,
select_one DBMP_subject,ACCESS__PHOTO_SUBJECT,Subject,,,,,,autocomplete,,,,,,,,,,,,esriFieldTypeString,4,,,,,,,,,,
text,ACCESS__PHOTO_COMMENT,Comment,,,,,,,,,,,,,,,,,,esriFieldTypeString,255,,,,,,,,,,
end repeat,,,,,,,,,,,,,,,,,,,,,,,,,,,,,,,
select_one DBMP_Insp_Sco_nozero,DEBRIS,Debris,"Scores the overall condition of the BMP related to the physical presence of unwanted woody / leafy material, garbage accumulations, and sedimentation that possibly can block the outlet structure.",,,yes,Debris is a <b>required</b> selection.,likert,nr,,,,,,,,,,,esriFieldTypeString,2,,,,,,,,,,
select_one DBMP_Insp_Sco,FENCES,Fencing,Scores the fencing condition by considering placement and structural condition when fencing exists to secure the BMP (other than right-of-way fencing).,,,yes,Fencing is a <b>required</b> selection.,likert,nr,,,,,,,,,,,esriFieldTypeString,2,,,,,,,,,,
select_one DBMP_Insp_Sco_nozero,PUB_HAZ,Public Hazard,"Evaluates the evidence of trespassing, temporary habitation, or downstream occupancy.",,,yes,Public Hazard is a <b>required</b> selection.,likert,nr,,,,,,,,,,,esriFieldTypeString,2,,,,,,,,,,
select_one DBMP_Insp_Sco,PUB_HAZ_POT,Potential for Public Hazard,Scores the <u>potential</u> for trespassing or temporary habitation based upon surrounding land uses.,,,yes,Potential for Public Hazard is a <b>required</b> selection.,likert,nr,,,,,,,,,,,esriFieldTypeString,2,,,,,,,,,,
select_one DBMP_Insp_Sco,BMP_VEG,BMP Vegetation,This parameter <b>must be evaluated during the growing season from May 15 to October 30</b>; otherwise the specific vegetation cannot be adequately assessed.,,,yes,BMP Vegetation is a <b>required</b> selection.,likert,nr,,${FO_UNDERGROUND_YN}='no',,,,,,,,,esriFieldTypeString,2,,,,,,,,,,
select_one DBMP_Insp_Sco_nozero,SITE_VEG,Site Vegetation,"Should be scored during the growing season from the dates of May 15 to October 30. <font color=""navy""><b><i>Site vegetation will always have a score of NR if inspection is being conducted between Oct 30th and May 15th unless conditions warrant a 3,4,5 rating of the parameter</i><b></font>",,,yes,Site Vegetation is a <b>required</b> selection.,likert,nr,,${FO_UNDERGROUND_YN}='no',,,,,,,,,esriFieldTypeString,2,,,,,,,,,,
begin repeat,BMP_R_SITE_VEG,Site Vegetation Issue Photos,,,,,,,,,${SITE_VEG}='3' or ${SITE_VEG}='4' or ${SITE_VEG}='5',,,,,,,,,,,,,,,,,,,,
image,SITE_VEG_PHOTO,Photo,,,,yes,Site Vegetation Photo required,,,,,,,,,,,,,,,,,,,,,,,,
select_one DBMP_subject,SITE_VEG_PHOTO_SUBJECT,Subject,,,,yes,Site Vegetation Subject required,autocomplete,,,,,,,,,,,,esriFieldTypeString,4,,,,,,,,,,
text,SITE_VEG_PHOTO_COMMENT,Comment,,,,yes,Site Vegetation Comment required,,,,,,,,,,,,,esriFieldTypeString,255,,,,,,,,,,
end repeat,,,,,,,,,,,,,,,,,,,,,,,,,,,,,,,
select_one DBMP_Insp_Sco_nozero,BMP_CONT,BMP Contamination,Scores the overall condition of the BMP related to residue of contaminants from nearby activities or non-point source pollution within the watershed.,,,yes,BMP Contamination is a <b>required</b> selection.,likert,nr,,,,,,,,,,,esriFieldTypeString,2,,,,,,,,,,
begin repeat,BMP_R_BMP_CONT,BMP Contamination Issue Photos,,,,,,,,,${BMP_CONT}='3' or ${BMP_CONT}='4' or ${BMP_CONT}='5',,,,,,,,,,,,,,,,,,,,
image,BMP_CONT_PHOTO,Photo,,,,yes,BMP Contamination Photo required,,,,,,,,,,,,,,,,,,,,,,,,
select_one DBMP_subject,BMP_CONT_PHOTO_SUBJECT,Subject,,,,yes,BMP Contamination Subject required,autocomplete,,,,,,,,,,,,esriFieldTypeString,4,,,,,,,,,,
text,BMP_CONT_PHOTO_COMMENT,Comment,,,,yes,BMP Contamination Comment required,,,,,,,,,,,,,esriFieldTypeString,255,,,,,,,,,,
end repeat,,,,,,,,,,,,,,,,,,,,,,,,,,,,,,,
select_one DBMP_Insp_Sco,PRETREAT,Pre-Treatment,Scores the BMP feature(s) relating to pretreatment of stormwater prior to entering the treatment area.,,,yes,Pre-Treatment is a <b>required</b> selection.,likert,nr,,,,,,,,,,,esriFieldTypeString,2,,,,,,,,,,
begin repeat,BMP_R_PRETREAT,Pre-Treatment Issue Photos,,,,,,,,,${PRETREAT}='3' or ${PRETREAT}='4' or ${PRETREAT}='5',,,,,,,,,,,,,,,,,,,,
image,PRETREAT_PHOTO,Photo,,,,yes,Pre-Treatment Photo required,,,,,,,,,,,,,,,,,,,,,,,,
select_one DBMP_subject,PRETREAT_PHOTO_SUBJECT,Subject,,,,yes,Pre-Treatment Subject required,autocomplete,,,,,,,,,,,,esriFieldTypeString,4,,,,,,,,,,
text,PRETREAT_PHOTO_COMMENT,Comment,,,,yes,Pre-Treatment Comment required,,,,,,,,,,,,,esriFieldTypeString,255,,,,,,,,,,
end repeat,,,,,,,,,,,,,,,,,,,,,,,,,,,,,,,
select_one DBMP_Insp_Sco,QIN_STAB,Inflow Stability,"Scores the condition of flows into a BMP such as areas of sheet flow, swales, and storm drains discharging into the BMP.",,,yes,Inflow Stability is a <b>required</b> selection.,likert,nr,,,,,,,,,,,esriFieldTypeString,2,,,,,,,,,,
begin repeat,BMP_R_QIN_STAB,Inflow Stability Issue Photos,,,,,,,,,${QIN_STAB}='3' or ${QIN_STAB}='4' or ${QIN_STAB}='5',,,,,,,,,,,,,,,,,,,,
image,QIN_STAB_PHOTO,Photo,,,,yes,Inflow Stability Photo required,,,,,,,,,,,,,,,,,,,,,,,,
select_one DBMP_subject,QIN_STAB_PHOTO_SUBJECT,Subject,,,,yes,Inflow Stability Subject required,autocomplete,,,,,,,,,,,,esriFieldTypeString,4,,,,,,,,,,
text,QIN_STAB_PHOTO_COMMENT,Comment,,,,yes,Inflow Stability Comment required,,,,,,,,,,,,,esriFieldTypeString,255,,,,,,,,,,
end repeat,,,,,,,,,,,,,,,,,,,,,,,,,,,,,,,
select_one DBMP_Insp_Sco,QIN_COND,Inflow Condition,Scores the overall impact of the discharges into a BMP and their adverse effects that may impair the performance of the BMP.,,,yes,Inflow Condition is a <b>required</b> selection.,likert,nr,,,,,,,,,,,esriFieldTypeString,2,,,,,,,,,,
begin repeat,BMP_R_QIN_COND,Inflow Condition Issue Photos,,,,,,,,,${QIN_COND}='3' or ${QIN_COND}='4' or ${QIN_COND}='5',,,,,,,,,,,,,,,,,,,,
image,QIN_COND_PHOTO,Photo,,,,yes,Inflow Condition Photo required,,,,,,,,,,,,,,,,,,,,,,,,
select_one DBMP_subject,QIN_COND_PHOTO_SUBJECT,Subject,,,,yes,Inflow Condition Subject required,autocomplete,,,,,,,,,,,,esriFieldTypeString,4,,,,,,,,,,
text,QIN_COND_PHOTO_COMMENT,Comment,,,,yes,Inflow Condition Comment required,,,,,,,,,,,,,esriFieldTypeString,255,,,,,,,,,,
end repeat,,,,,,,,,,,,,,,,,,,,,,,,,,,,,,,
select_one DBMP_Insp_Sco,DS_CONDITION,Downstream Condition,Scores the overall downstream channel conditions beyond the SHA ROW.,,,yes,Downstream Condition is a <b>required</b> selection.,likert,nr,,,,,,,,,,,esriFieldTypeString,50,,,,,,,,,,
begin repeat,BMP_R_DS_CONDITION,Downstream Condition Issue Photos,,,,,,,,,${DS_CONDITION}='3' or ${DS_CONDITION}='4' or ${DS_CONDITION}='5',,,,,,,,,,,,,,,,,,,,
image,DS_CONDITION_PHOTO,Photo,,,,yes,Downstream Condition Photo required,,,,,,,,,,,,,,,,,,,,,,,,
select_one DBMP_subject,DS_CONDITION_PHOTO_SUBJECT,Subject,,,,yes,Downstream Condition Subject required,autocomplete,,,,,,,,,,,,esriFieldTypeString,4,,,,,,,,,,
text,DS_CONDITION_PHOTO_COMMENT,Comment,,,,yes,Downstream Condition Comment required,,,,,,,,,,,,,esriFieldTypeString,255,,,,,,,,,,
end repeat,,,,,,,,,,,,,,,,,,,,,,,,,,,,,,,
select_one DBMP_Insp_Sco,CONVEY_STABILITY,Conveyance Stability,Scores the stability of flow conveyance through the stormwater treatment area.,,,yes,Conveyance Stability is a <b>required</b> selection.,likert,nr,,,,,,,,,,,esriFieldTypeString,50,,,,,,,,,,
end group,,,,,,,,,,,,,,,,,,,,,,,,,,,,,,,
,,,,,,,,,,,,,,,,,,,,,,,,,,,,,,,
begin group,G_EMBANKMENT,Embankment,,,,,,field-list,,,,,,,,,,,,,,,,,,,,,,,
select_one DBMP_Insp_Sco,EMBU_CVR,Upstream Cover,"This parameter scores the overall vegetative condition of the upstream slope of the embankment, including within 15 feet of the embankment toe, related to type, size and percent coverage.  <font color=""navy""><b><i>Typically, this is scored during the growing season from May 15 to October 30.</i><b></font>",,,yes,Upstream Cover is a <b>required</b> selection.,likert,nr,,${FO_UNDERGROUND_YN}='no',,,,,,,,,esriFieldTypeString,2,,,,,,,,,,
begin repeat,BMP_R_EMBU_CVR,Upstream Cover Issue Photos,,,,,,,,,${EMBU_CVR}='3' or ${EMBU_CVR}='4' or ${EMBU_CVR}='5',,,,,,,,,,,,,,,,,,,,
image,EMBU_CVR_PHOTO,Photo,,,,yes,Upstream Cover Photo required,,,,,,,,,,,,,,,,,,,,,,,,
select_one DBMP_subject,EMBU_CVR_PHOTO_SUBJECT,Subject,,,,yes,Upstream Cover Subject required,autocomplete,,,,,,,,,,,,esriFieldTypeString,4,,,,,,,,,,
text,EMBU_CVR_PHOTO_COMMENT,Comment,,,,yes,Upstream Cover Comment required,,,,,,,,,,,,,esriFieldTypeString,255,,,,,,,,,,
end repeat,,,,,,,,,,,,,,,,,,,,,,,,,,,,,,,
select_one DBMP_Insp_Sco,EMBU_ERO,Upstream Embankment Erosion,Scores the condition of the upstream embankment stability related to erosion.,,,yes,Upstream Embankment Erosion is a <b>required</b> selection.,likert,nr,,${FO_UNDERGROUND_YN}='no',,,,,,,,,esriFieldTypeString,2,,,,,,,,,,
begin repeat,BMP_R_EMBU_ERO,Upstream Embankment Erosion Issue Photos,,,,,,,,,${EMBU_ERO}='3' or ${EMBU_ERO}='4' or ${EMBU_ERO}='5',,,,,,,,,,,,,,,,,,,,
image,EMBU_ERO_PHOTO,Photo,,,,yes,Upstream Embankment Erosion Photo required,,,,,,,,,,,,,,,,,,,,,,,,
select_one DBMP_subject,EMBU_ERO_PHOTO_SUBJECT,Subject,,,,yes,Upstream Embankment Erosion Subject required,autocomplete,,,,,,,,,,,,esriFieldTypeString,4,,,,,,,,,,
text,EMBU_ERO_PHOTO_COMMENT,Comment,,,,yes,Upstream Embankment Erosion Comment required,,,,,,,,,,,,,esriFieldTypeString,255,,,,,,,,,,
end repeat,,,,,,,,,,,,,,,,,,,,,,,,,,,,,,,
select_one DBMP_Insp_Sco,EMBU_TOE,Upstream Embankment Toe,Scores the condition of the upstream stability within 15 feet of the upstream toe of embankment.,,,yes,Upstream Embankment Toe is a <b>required</b> selection.,likert,nr,,${FO_UNDERGROUND_YN}='no',,,,,,,,,esriFieldTypeString,2,,,,,,,,,,
begin repeat,BMP_R_EMBU_TOE,Upstream Embankment Toe Issue Photos,,,,,,,,,${EMBU_TOE}='3' or ${EMBU_TOE}='4' or ${EMBU_TOE}='5',,,,,,,,,,,,,,,,,,,,
image,EMBU_TOE_PHOTO,Photo,,,,yes,Upstream Embankment Toe Photo required,,,,,,,,,,,,,,,,,,,,,,,,
select_one DBMP_subject,EMBU_TOE_PHOTO_SUBJECT,Subject,,,,yes,Upstream Embankment Toe Subject required,autocomplete,,,,,,,,,,,,esriFieldTypeString,4,,,,,,,,,,
text,EMBU_TOE_PHOTO_COMMENT,Comment,,,,yes,Upstream Embankment Toe Comment required,,,,,,,,,,,,,esriFieldTypeString,255,,,,,,,,,,
end repeat,,,,,,,,,,,,,,,,,,,,,,,,,,,,,,,
select_one DBMP_Insp_Sco,EMBD_CVR,Downstream Cover,"This parameter scores the overall vegetative condition of the downstream slope of the embankment, including within 15 feet of the embankment toe, related to type, size and percent coverage.  <font color=""navy""><b><i>Typically, this is scored during the growing season from May 15 to October 30.</i><b></font>",,,yes,Downstream Cover is a <b>required</b> selection.,likert,nr,,${FO_UNDERGROUND_YN}='no',,,,,,,,,esriFieldTypeString,2,,,,,,,,,,
begin repeat,BMP_R_EMBD_CVR,Downstream Cover Issue Photos,,,,,,,,,${EMBD_CVR}='3' or ${EMBD_CVR}='4' or ${EMBD_CVR}='5',,,,,,,,,,,,,,,,,,,,
image,EMBD_CVR_PHOTO,Photo,,,,yes,Downstream Cover Photo required,,,,,,,,,,,,,,,,,,,,,,,,
select_one DBMP_subject,EMBD_CVR_PHOTO_SUBJECT,Subject,,,,yes,Downstream Cover Subject required,autocomplete,,,,,,,,,,,,esriFieldTypeString,4,,,,,,,,,,
text,EMBD_CVR_PHOTO_COMMENT,Comment,,,,yes,Downstream Cover Comment required,,,,,,,,,,,,,esriFieldTypeString,255,,,,,,,,,,
end repeat,,,,,,,,,,,,,,,,,,,,,,,,,,,,,,,
select_one DBMP_Insp_Sco,EMBD_ERO,Downstream Embankment Erosion,Scores the condition of the downstream embankment stability related to erosion.,,,yes,Downstream Embankment Erosion is a <b>required</b> selection.,likert,nr,,${FO_UNDERGROUND_YN}='no',,,,,,,,,esriFieldTypeString,2,,,,,,,,,,
begin repeat,BMP_R_EMBD_ERO,Downstream Embankment Erosion Issue Photos,,,,,,,,,${EMBD_ERO}='3' or ${EMBD_ERO}='4' or ${EMBD_ERO}='5',,,,,,,,,,,,,,,,,,,,
image,EMBD_ERO_PHOTO,Photo,,,,yes,Downstream Embankment Erosion Photo required,,,,,,,,,,,,,,,,,,,,,,,,
select_one DBMP_subject,EMBD_ERO_PHOTO_SUBJECT,Subject,,,,yes,Downstream Embankment Erosion Subject required,autocomplete,,,,,,,,,,,,esriFieldTypeString,4,,,,,,,,,,
text,EMBD_ERO_PHOTO_COMMENT,Comment,,,,yes,Downstream Embankment Erosion Comment required,,,,,,,,,,,,,esriFieldTypeString,255,,,,,,,,,,
end repeat,,,,,,,,,,,,,,,,,,,,,,,,,,,,,,,
select_one DBMP_Insp_Sco,EMBD_TOE,Downstream Embankment Toe,Scores the condition of the downstream stability within 15 feet of the downstream toe of embankment.,,,yes,Downstream Embankment Toe is a <b>required</b> selection.,likert,nr,,${FO_UNDERGROUND_YN}='no',,,,,,,,,esriFieldTypeString,2,,,,,,,,,,
begin repeat,BMP_R_EMBD_TOE,Downstream Embankment Toe Issue Photos,,,,,,,,,${EMBD_TOE}='3' or ${EMBD_TOE}='4' or ${EMBD_TOE}='5',,,,,,,,,,,,,,,,,,,,
image,EMBD_TOE_PHOTO,Photo,,,,yes,Downstream Embankment Toe Photo required,,,,,,,,,,,,,,,,,,,,,,,,
select_one DBMP_subject,EMBD_TOE_PHOTO_SUBJECT,Subject,,,,yes,Downstream Embankment Toe Subject required,autocomplete,,,,,,,,,,,,esriFieldTypeString,4,,,,,,,,,,
text,EMBD_TOE_PHOTO_COMMENT,Comment,,,,yes,Downstream Embankment Toe Comment required,,,,,,,,,,,,,esriFieldTypeString,255,,,,,,,,,,
end repeat,,,,,,,,,,,,,,,,,,,,,,,,,,,,,,,
select_one DBMP_Insp_Sco,EMBD_SEEP,Embankment Seepage,Scores the condition of downstream embankment related to water seeping out.,,,yes,Embankment Seepage is a <b>required</b> selection.,likert,nr,,${FO_UNDERGROUND_YN}='no',,,,,,,,,esriFieldTypeString,2,,,,,,,,,,
begin repeat,BMP_R_EMBD_SEEP,Embankment Seepage Issue Photos,,,,,,,,,${EMBD_SEEP}='3' or ${EMBD_SEEP}='4' or ${EMBD_SEEP}='5',,,,,,,,,,,,,,,,,,,,
image,EMBD_SEEP_PHOTO,Photo,,,,yes,Embankment Seepage Photo required,,,,,,,,,,,,,,,,,,,,,,,,
select_one DBMP_subject,EMBD_SEEP_PHOTO_SUBJECT,Subject,,,,yes,Embankment Seepage Subject required,autocomplete,,,,,,,,,,,,esriFieldTypeString,4,,,,,,,,,,
text,EMBD_SEEP_PHOTO_COMMENT,Comment,,,,yes,Embankment Seepage Comment required,,,,,,,,,,,,,esriFieldTypeString,255,,,,,,,,,,
end repeat,,,,,,,,,,,,,,,,,,,,,,,,,,,,,,,
select_one DBMP_Insp_Sco,ESPW_OPEN,Emergency Spillway Opening,Scores the condition of the emergency spillway weir opening to function as designed when necessary.,,,yes,Emergency Spillway Opening is a <b>required</b> selection.,likert,nr,,,,,,,,,,,esriFieldTypeString,2,,,,,,,,,,
begin repeat,BMP_R_ESPW_OPEN,Emergency Spillway Opening Issue Photos,,,,,,,,,${ESPW_OPEN}='3' or ${ESPW_OPEN}='4' or ${ESPW_OPEN}='5',,,,,,,,,,,,,,,,,,,,
image,ESPW_OPEN_PHOTO,Photo,,,,yes,Emergency Spillway Opening Photo required,,,,,,,,,,,,,,,,,,,,,,,,
select_one DBMP_subject,ESPW_OPEN_PHOTO_SUBJECT,Subject,,,,yes,Emergency Spillway Opening Subject required,autocomplete,,,,,,,,,,,,esriFieldTypeString,4,,,,,,,,,,
text,ESPW_OPEN_PHOTO_COMMENT,Comment,,,,yes,Emergency Spillway Opening Comment required,,,,,,,,,,,,,esriFieldTypeString,255,,,,,,,,,,
end repeat,,,,,,,,,,,,,,,,,,,,,,,,,,,,,,,
select_one DBMP_Insp_Sco,ESPW_STAB,Emergency Spillway Stability,Scores the stability of the emergency spillway relating to erosion of sides and bottom.,,,yes,Emergency Spillway Stability is a <b>required</b> selection.,likert,nr,,,,,,,,,,,esriFieldTypeString,2,,,,,,,,,,
begin repeat,BMP_R_ESPW_STAB,Emergency Spillway Stability Issue Photos,,,,,,,,,${ESPW_STAB}='3' or ${ESPW_STAB}='4' or ${ESPW_STAB}='5',,,,,,,,,,,,,,,,,,,,
image,ESPW_STAB_PHOTO,Photo,,,,yes,Emergency Spillway Stability Photo required,,,,,,,,,,,,,,,,,,,,,,,,
select_one DBMP_subject,ESPW_STAB_PHOTO_SUBJECT,Subject,,,,yes,Emergency Spillway Stability Subject required,autocomplete,,,,,,,,,,,,esriFieldTypeString,4,,,,,,,,,,
text,ESPW_STAB_PHOTO_COMMENT,Comment,,,,yes,Emergency Spillway Stability Comment required,,,,,,,,,,,,,esriFieldTypeString,255,,,,,,,,,,
end repeat,,,,,,,,,,,,,,,,,,,,,,,,,,,,,,,
end group,,,,,,,,,,,,,,,,,,,,,,,,,,,,,,,
,,,,,,,,,,,,,,,,,,,,,,,,,,,,,,,
begin group,G_POND_RISER,Pond & Control Structures,,,,,,,,,,,,,,,,,,,,,,,,,,,,,
select_one DBMP_Insp_Sco,SAFE_WATERDEPTH,Safe Water Depth,Scores the potential safety risk to the public due to deep water.,,,yes,Safe Water Depth is a <b>required</b> selection.,likert,nr,,,,,,,,,,,esriFieldTypeString,255,,,,,,,,,,
select_one DBMP_Insp_Sco,PONDING,Ponding,Scores the accumulation of stormwater beyond 72 hours after a storm event resulting in loss of storage for water quality and / or detention.,,,yes,Ponding is a <b>required</b> selection.,likert,nr,,,,,,,,,,,esriFieldTypeString,2,,,,,,,,,,
begin repeat,BMP_R_PONDING,Ponding Photos,,,,,,,,,${PONDING}='3' or ${PONDING}='4' or ${PONDING}='5',,,,,,,,,,,,,,,,,,,,
image,PONDING_PHOTO,Photo,,,,yes,Ponding Photo required,,,,,,,,,,,,,,,,,,,,,,,,
select_one DBMP_subject,PONDING_PHOTO_SUBJECT,Subject,,,,yes,Ponding Subject required,autocomplete,,,,,,,,,,,,esriFieldTypeString,4,,,,,,,,,,
text,PONDING_PHOTO_COMMENT,Comment,,,,yes,Ponding Comment required,,,,,,,,,,,,,esriFieldTypeString,255,,,,,,,,,,
end repeat,,,,,,,,,,,,,,,,,,,,,,,,,,,,,,,
decimal,WAT_DEPTH,Water Depth (ft.),Measurement of the depth of the excessive ponded water in the facility.,,,,,calculator,,,,,,,,,,,,esriFieldTypeDouble,,,,,,,,,,,
select_one DBMP_Insp_Sco,PERMPOOL,Permanent Pooling,Scores the condition of BMPs with permanent standing water that is designed for water quality treatment.,,,yes,Permanent Pooling is a <b>required</b> selection.,likert,nr,,${FO_UNDERGROUND_YN}='no',,,,,,,,,esriFieldTypeString,2,,,,,,,,,,
select_one DBMP_Insp_Sco,ORF_OPEN,Orifice Opening,Scores the opening of the low-flow orifice to allow for proper drainage of the BMP.,,,yes,Orifice Opening is a <b>required</b> selection.,likert,nr,,,,,,,,,,,esriFieldTypeString,2,,,,,,,,,,
begin repeat,BMP_R_ORF_OPEN,Orifice Opening Photos,,,,,,,,,${ORF_OPEN}='3' or ${ORF_OPEN}='4' or ${ORF_OPEN}='5',,,,,,,,,,,,,,,,,,,,
image,ORF_OPEN_PHOTO,Photo,,,,yes,Orifice Opening Photo required,,,,,,,,,,,,,,,,,,,,,,,,
select_one DBMP_subject,ORF_OPEN_PHOTO_SUBJECT,Subject,,,,yes,Orifice Opening Subject required,autocomplete,,,,,,,,,,,,esriFieldTypeString,4,,,,,,,,,,
text,ORF_OPEN_PHOTO_COMMENT,Comment,,,,yes,Orifice Opening Comment required,,,,,,,,,,,,,esriFieldTypeString,255,,,,,,,,,,
end repeat,,,,,,,,,,,,,,,,,,,,,,,,,,,,,,,
select_one DBMP_Insp_Sco,ORF_TRSH,Orifice Trash Rack,Scores the structural condition of the trash rack on the low-flow orifice.,,,yes,Orifice Trash Rack is a <b>required</b> selection.,likert,nr,,,,,,,,,,,esriFieldTypeString,2,,,,,,,,,,
begin repeat,BMP_R_ORF_TRSH,Orifice Trash Rack Photos,,,,,,,,,${ORF_TRSH}='3' or ${ORF_TRSH}='4' or ${ORF_TRSH}='5',,,,,,,,,,,,,,,,,,,,
image,ORF_TRSH_PHOTO,Photo,,,,yes,Orifice Trash Rack Photo required,,,,,,,,,,,,,,,,,,,,,,,,
select_one DBMP_subject,ORF_TRSH_PHOTO_SUBJECT,Subject,,,,yes,Orifice Trash Rack Subject required,autocomplete,,,,,,,,,,,,esriFieldTypeString,4,,,,,,,,,,
text,ORF_TRSH_PHOTO_COMMENT,Comment,,,,yes,Orifice Trash Rack Comment required,,,,,,,,,,,,,esriFieldTypeString,255,,,,,,,,,,
end repeat,,,,,,,,,,,,,,,,,,,,,,,,,,,,,,,
select_one DBMP_Insp_Sco,RSR_STRC,Control Structure,Scores the overall structural integrity of the riser weir or outlet structure.,,,yes,Control Structure is a <b>required</b> selection.,likert,nr,,,,,,,,,,,esriFieldTypeString,2,,,,,,,,,,
begin repeat,BMP_R_RSR_STRC,Control Structure Photos,,,,,,,,,${RSR_STRC}='3' or ${RSR_STRC}='4' or ${RSR_STRC}='5',,,,,,,,,,,,,,,,,,,,
image,RSR_STRC_PHOTO,Photo,,,,yes,Control Structure Photo required,,,,,,,,,,,,,,,,,,,,,,,,
select_one DBMP_subject,RSR_STRC_PHOTO_SUBJECT,Subject,,,,yes,Control Structure Subject required,autocomplete,,,,,,,,,,,,esriFieldTypeString,4,,,,,,,,,,
text,RSR_STRC_PHOTO_COMMENT,Comment,,,,yes,Control Structure Comment required,,,,,,,,,,,,,esriFieldTypeString,255,,,,,,,,,,
end repeat,,,,,,,,,,,,,,,,,,,,,,,,,,,,,,,
select_one DBMP_Insp_Sco,RSR_OPEN,Control Structure Opening,"Scores the openings of the riser structure, weir, or end-section (also headwall) to allow for proper flow through the spillway.",,,yes,Control Structure Opening is a <b>required</b> selection.,likert,nr,,${RSR_STRC}!='0',,,,,,,,,esriFieldTypeString,2,,,,,,,,,,
begin repeat,BMP_R_RSR_OPEN,Control Structure Opening Photos,,,,,,,,,${RSR_OPEN}='3' or ${RSR_OPEN}='4' or ${RSR_OPEN}='5',,,,,,,,,,,,,,,,,,,,
image,RSR_OPEN_PHOTO,Photo,,,,yes,Control Structure Opening Photo required,,,,,,,,,,,,,,,,,,,,,,,,
select_one DBMP_subject,RSR_OPEN_PHOTO_SUBJECT,Subject,,,,yes,Control Structure Opening Subject required,autocomplete,,,,,,,,,,,,esriFieldTypeString,4,,,,,,,,,,
text,RSR_OPEN_PHOTO_COMMENT,Comment,,,,yes,Control Structure Opening Comment required,,,,,,,,,,,,,esriFieldTypeString,255,,,,,,,,,,
end repeat,,,,,,,,,,,,,,,,,,,,,,,,,,,,,,,
select_one DBMP_Insp_Sco,RSR_SEDI,Control Structure Sediment,Scores the amount of sediment accumulated inside the riser structure that could restrict the riser performance.,,,yes,Control Structure Sediment is a <b>required</b> selection.,likert,nr,,${RSR_STRC}!='0',,,,,,,,,esriFieldTypeString,2,,,,,,,,,,
begin repeat,BMP_R_RSR_SEDI,Control Structure Sediment Photos,,,,,,,,,${RSR_SEDI}='3' or ${RSR_SEDI}='4' or ${RSR_SEDI}='5',,,,,,,,,,,,,,,,,,,,
image,RSR_SEDI_PHOTO,Photo,,,,yes,Control Structure Sediment Photo required,,,,,,,,,,,,,,,,,,,,,,,,
select_one DBMP_subject,RSR_SEDI_PHOTO_SUBJECT,Subject,,,,yes,Control Structure Sediment Subject required,autocomplete,,,,,,,,,,,,esriFieldTypeString,4,,,,,,,,,,
text,RSR_SEDI_PHOTO_COMMENT,Comment,,,,yes,Control Structure Sediment Comment required,,,,,,,,,,,,,esriFieldTypeString,255,,,,,,,,,,
end repeat,,,,,,,,,,,,,,,,,,,,,,,,,,,,,,,
select_one DBMP_Insp_Sco,RSR_TRSH,Control Structure Trash Rack,Scores the structural condition of the trash rack on the riser structure.,,,yes,Control Structure Trash Rack is a <b>required</b> selection.,likert,nr,,${RSR_STRC}!='0',,,,,,,,,esriFieldTypeString,2,,,,,,,,,,
